{
  "contractVersion": 1,
  "kind": "platform",
  "sdk": "dotnet",
  "source": "releases-index",
  "current": {
    "channels": [
      "10.0"
    ],
    "preview": false
  },
  "locations": [
    {
      "file": ".github/workflows/dotnet-build-master.yml",
      "kind": "setup-action",
      "value": "10.0.100",
      "channel": "10.0",
      "computed": false,
      "reason": null
    },
    {
      "file": ".github/workflows/pull-request.yml",
      "kind": "setup-action",
      "value": "10.0.100",
      "channel": "10.0",
      "computed": false,
      "reason": null
    },
    {
      "file": "apps/CodeCoverage/CodeCoverage.BitbucketIntegration/CodeCoverage.BitbucketIntegration.csproj",
      "kind": "tfm",
      "value": "net10.0",
      "channel": "10.0",
      "computed": false,
      "reason": null
    },
    {
      "file": "apps/CodeCoverage/CodeCoverage.GithubIntegration/CodeCoverage.GithubIntegration.csproj",
      "kind": "tfm",
      "value": "net10.0",
      "channel": "10.0",
      "computed": false,
      "reason": null
    },
    {
      "file": "apps/CodeCoverage/CodeCoverage.GitlabIntegration/CodeCoverage.GitlabIntegration.csproj",
      "kind": "tfm",
      "value": "net10.0",
      "channel": "10.0",
      "computed": false,
      "reason": null
    },
    {
      "file": "apps/CodeCoverage/CodeCoverage.Library/CodeCoverage.Library.csproj",
      "kind": "tfm",
      "value": "net10.0",
      "channel": "10.0",
      "computed": false,
      "reason": null
    },
    {
      "file": "apps/CodeCoverage/CodeCoverage.Tests/CodeCoverage.Tests.csproj",
      "kind": "tfm",
      "value": "net10.0",
      "channel": "10.0",
      "computed": false,
      "reason": null
    },
    {
      "file": "apps/CodeCoverage/CodeCoverage/CodeCoverage.csproj",
      "kind": "tfm",
      "value": "net10.0",
      "channel": "10.0",
      "computed": false,
      "reason": null
    },
    {
      "file": "apps/CodeCoverage/CodeCoverage/Dockerfile",
      "kind": "docker",
      "value": "10.0",
      "channel": "10.0",
      "computed": false,
      "reason": null
    },
    {
      "file": "apps/CodeCoverage/CodeCoverage/Dockerfile",
      "kind": "docker",
      "value": "10.0",
      "channel": "10.0",
      "computed": false,
      "reason": null
    },
    {
      "file": "apps/DemoApp/DemoApp.Library/DemoApp.Library.csproj",
      "kind": "tfm",
      "value": "net10.0",
      "channel": "10.0",
      "computed": false,
      "reason": null
    },
    {
      "file": "apps/DemoApp/DemoApp/DemoApp.csproj",
      "kind": "tfm",
      "value": "net10.0",
      "channel": "10.0",
      "computed": false,
      "reason": null
    },
    {
      "file": "apps/Fleet/Fleet.Library/Fleet.Library.csproj",
      "kind": "tfm",
      "value": "net10.0",
      "channel": "10.0",
      "computed": false,
      "reason": null
    },
    {
      "file": "apps/Fleet/Fleet/Fleet.csproj",
      "kind": "tfm",
      "value": "net10.0",
      "channel": "10.0",
      "computed": false,
      "reason": null
    },
    {
      "file": "apps/HR/HR.Library/HR.Library.csproj",
      "kind": "tfm",
      "value": "net10.0",
      "channel": "10.0",
      "computed": false,
      "reason": null
    },
    {
      "file": "apps/HR/HR/HR.csproj",
      "kind": "tfm",
      "value": "net10.0",
      "channel": "10.0",
      "computed": false,
      "reason": null
    },
    {
      "file": "global.json",
      "kind": "global.json",
      "value": "10.0.100",
      "channel": "10.0",
      "computed": false,
      "reason": null
    },
    {
      "file": "libs/all_features/MintPlayer.Spark.AllFeatures.SourceGenerators/MintPlayer.Spark.AllFeatures.SourceGenerators.csproj",
      "kind": "tfm",
      "value": "netstandard2.0",
      "channel": null,
      "computed": false,
      "reason": null
    },
    {
      "file": "libs/all_features/MintPlayer.Spark.AllFeatures.SourceGenerators/MintPlayer.Spark.AllFeatures.SourceGenerators.csproj",
      "kind": "package-version",
      "value": "10.0.0-preview.84",
      "channel": "10.0",
      "computed": false,
      "reason": null
    },
    {
      "file": "libs/all_features/MintPlayer.Spark.AllFeatures/MintPlayer.Spark.AllFeatures.csproj",
      "kind": "tfm",
      "value": "net10.0",
      "channel": "10.0",
      "computed": false,
      "reason": null
    },
    {
      "file": "libs/all_features/MintPlayer.Spark.AllFeatures/MintPlayer.Spark.AllFeatures.csproj",
      "kind": "package-version",
      "value": "10.0.0-preview.84",
      "channel": "10.0",
      "computed": false,
      "reason": null
    },
    {
      "file": "libs/attributes/MintPlayer.Spark.Attributes/MintPlayer.Spark.Attributes.csproj",
      "kind": "tfm",
      "value": "net10.0",
      "channel": "10.0",
      "computed": false,
      "reason": null
    },
    {
      "file": "libs/attributes/MintPlayer.Spark.Attributes/MintPlayer.Spark.Attributes.csproj",
      "kind": "package-version",
      "value": "10.0.0-preview.86",
      "channel": "10.0",
      "computed": false,
      "reason": null
    },
    {
      "file": "libs/authorization/MintPlayer.Spark.Authorization/MintPlayer.Spark.Authorization.csproj",
      "kind": "tfm",
      "value": "net10.0",
      "channel": "10.0",
      "computed": false,
      "reason": null
    },
    {
      "file": "libs/authorization/MintPlayer.Spark.Authorization/MintPlayer.Spark.Authorization.csproj",
      "kind": "package-version",
      "value": "10.0.0-preview.85",
      "channel": "10.0",
      "computed": false,
      "reason": null
    },
    {
      "file": "libs/client/MintPlayer.Spark.Client.Authorization/MintPlayer.Spark.Client.Authorization.csproj",
      "kind": "tfm",
      "value": "net10.0",
      "channel": "10.0",
      "computed": false,
      "reason": null
    },
    {
      "file": "libs/client/MintPlayer.Spark.Client.Authorization/MintPlayer.Spark.Client.Authorization.csproj",
      "kind": "package-version",
      "value": "10.0.0-preview.84",
      "channel": "10.0",
      "computed": false,
      "reason": null
    },
    {
      "file": "libs/client/MintPlayer.Spark.Client/MintPlayer.Spark.Client.csproj",
      "kind": "tfm",
      "value": "net10.0",
      "channel": "10.0",
      "computed": false,
      "reason": null
    },
    {
      "file": "libs/client/MintPlayer.Spark.Client/MintPlayer.Spark.Client.csproj",
      "kind": "package-version",
      "value": "10.0.0-preview.85",
      "channel": "10.0",
      "computed": false,
      "reason": null
    },
    {
      "file": "libs/controllers/MintPlayer.Spark.Controllers/MintPlayer.Spark.Controllers.csproj",
      "kind": "tfm",
      "value": "net10.0",
      "channel": "10.0",
      "computed": false,
      "reason": null
    },
    {
      "file": "libs/controllers/MintPlayer.Spark.Controllers/MintPlayer.Spark.Controllers.csproj",
      "kind": "package-version",
      "value": "10.0.0-preview.84",
      "channel": "10.0",
      "computed": false,
      "reason": null
    },
    {
      "file": "libs/cron/MintPlayer.Spark.Cron/MintPlayer.Spark.Cron.csproj",
      "kind": "tfm",
      "value": "net10.0",
      "channel": "10.0",
      "computed": false,
      "reason": null
    },
    {
      "file": "libs/cron/MintPlayer.Spark.Cron/MintPlayer.Spark.Cron.csproj",
      "kind": "package-version",
      "value": "10.0.0-preview.84",
      "channel": "10.0",
      "computed": false,
      "reason": null
    },
    {
      "file": "libs/identity_provider/MintPlayer.Spark.IdentityProvider/MintPlayer.Spark.IdentityProvider.csproj",
      "kind": "tfm",
      "value": "net10.0",
      "channel": "10.0",
      "computed": false,
      "reason": null
    },
    {
      "file": "libs/identity_provider/MintPlayer.Spark.IdentityProvider/MintPlayer.Spark.IdentityProvider.csproj",
      "kind": "package-version",
      "value": "10.0.0-preview.86",
      "channel": "10.0",
      "computed": false,
      "reason": null
    },
    {
      "file": "libs/messaging/MintPlayer.Spark.Messaging.Abstractions/MintPlayer.Spark.Messaging.Abstractions.csproj",
      "kind": "tfm",
      "value": "net10.0",
      "channel": "10.0",
      "computed": false,
      "reason": null
    },
    {
      "file": "libs/messaging/MintPlayer.Spark.Messaging.Abstractions/MintPlayer.Spark.Messaging.Abstractions.csproj",
      "kind": "package-version",
      "value": "10.0.0-preview.84",
      "channel": "10.0",
      "computed": false,
      "reason": null
    },
    {
      "file": "libs/messaging/MintPlayer.Spark.Messaging/MintPlayer.Spark.Messaging.csproj",
      "kind": "tfm",
      "value": "net10.0",
      "channel": "10.0",
      "computed": false,
      "reason": null
    },
    {
      "file": "libs/messaging/MintPlayer.Spark.Messaging/MintPlayer.Spark.Messaging.csproj",
      "kind": "package-version",
      "value": "10.0.0-preview.84",
      "channel": "10.0",
      "computed": false,
      "reason": null
    },
    {
      "file": "libs/migrations/MintPlayer.Spark.Migrations/MintPlayer.Spark.Migrations.csproj",
      "kind": "tfm",
      "value": "net10.0",
      "channel": "10.0",
      "computed": false,
      "reason": null
    },
    {
      "file": "libs/migrations/MintPlayer.Spark.Migrations/MintPlayer.Spark.Migrations.csproj",
      "kind": "package-version",
      "value": "10.0.0-preview.84",
      "channel": "10.0",
      "computed": false,
      "reason": null
    },
    {
      "file": "libs/replication/MintPlayer.Spark.Replication.Abstractions/MintPlayer.Spark.Replication.Abstractions.csproj",
      "kind": "tfm",
      "value": "net10.0",
      "channel": "10.0",
      "computed": false,
      "reason": null
    },
    {
      "file": "libs/replication/MintPlayer.Spark.Replication.Abstractions/MintPlayer.Spark.Replication.Abstractions.csproj",
      "kind": "package-version",
      "value": "10.0.0-preview.84",
      "channel": "10.0",
      "computed": false,
      "reason": null
    },
    {